{
  "$schema": "https://json-schema.org/draft/2020-12/schema",
  "$id": "https://line7.works/schemas/records/resolutions.schema.json",
  "title": "records resolutions file",
  "description": "The owner's answers to the ambiguous lines of one legacy document (records E12 contract section 11.5). When an import stops, its exit-5 report lists every ambiguous line with its number, its raw text, the reason, and the candidate finding IDs; this file answers them. Each answer carries `raw`, the line's text as it was when the answer was given, so that section 11.5's rule \"a resolution that names a line whose raw text has changed is rejected\" is checkable from the file alone. An answer that names a line the import did not stop on, a line whose raw text no longer matches, a finding the document does not raise, or an answer shape the question cannot take, is rejected (exit 4) and nothing is written.",
  "type": "object",
  "additionalProperties": false,
  "required": ["answered_by", "answered_on", "answers"],
  "properties": {
    "answered_by": {
      "type": "string",
      "minLength": 1,
      "description": "who answered; the owner, or a session acting on the owner's word"
    },
    "answered_on": {
      "$ref": "#/$defs/calendar_date",
      "description": "the date the answers were given; it becomes the `at` of every resolution_applied event"
    },
    "doc": {
      "type": "string",
      "minLength": 1,
      "description": "optional: the ledger document these answers are for, workspace-relative. The importer refuses a file that names another document."
    },
    "note": {"type": "string", "description": "optional free text; the component reads nothing from it"},
    "answers": {
      "type": "array",
      "minItems": 1,
      "items": {"$ref": "#/$defs/answer"}
    }
  },
  "$defs": {
    "calendar_date": {
      "type": "string",
      "format": "date",
      "pattern": "^[0-9]{4}-[0-9]{2}-[0-9]{2}$"
    },
    "answer": {
      "type": "object",
      "additionalProperties": false,
      "required": ["line", "raw"],
      "properties": {
        "line": {"type": "integer", "minimum": 1, "description": "the 1-based line of the legacy document"},
        "raw": {"type": "string", "description": "the line exactly as the exit-5 report gave it"},
        "finding": {
          "type": "string",
          "pattern": "^f[1-9][0-9]*:[0-9a-f]{20}$",
          "description": "this line belongs to that finding"
        },
        "new_finding": {"const": true, "description": "this line raises a finding of its own"},
        "skip": {"const": true, "description": "record the line as legacy_unparsed and move on"},
        "why": {"type": "string", "minLength": 1, "description": "required with skip; it becomes the legacy_unparsed reason"}
      },
      "oneOf": [
        {"required": ["finding"], "properties": {"new_finding": false, "skip": false, "why": false}},
        {"required": ["new_finding"], "properties": {"finding": false, "skip": false, "why": false}},
        {"required": ["skip", "why"], "properties": {"finding": false, "new_finding": false}}
      ],
      "description": "exactly one of finding, new_finding, or skip; skip carries its reason"
    }
  }
}
